{
  "$schema": "http://json-schema.org/draft-07/schema#",
  "type": "object",
  "required": ["event_id", "agent_id", "event_type", "payload", "enrichment", "timestamp"],
  "properties": {
    "event_id": { "type": "string" },
    "agent_id": { "type": "string" },
    "event_type": { "type": "string" },
    "payload": { "type": "object" },
    "enrichment": {
      "type": "object",
      "properties": {
        "iocs": { "type": "object" },
        "yara_hits": { "type": "array", "items": { "type": "string" } },
        "reputation": { "type": "object" },
        "geoip": { "type": "object" },
        "threat_score": { "type": "number" }
      }
    },
    "timestamp": { "type": "string", "format": "date-time" }
  }
}